{
  "schemaVersion": 1,
  "academicYear": 2027,
  "schedules": [
    {
      "schoolId": "wk_d113299901022",
      "academicYear": 2027,
      "selection": "recommendation",
      "selectionLabel": "推薦に基づく選抜",
      "status": "schedule-announced",
      "statusLabel": "共通日程発表済み",
      "applicationPeriod": "志願者情報入力：2026年12月18日〜2027年1月18日17:00／書類提出：2027年1月8日〜1月18日",
      "testDates": [
        "2027年1月26日（火）",
        "2027年1月27日（水）"
      ],
      "resultDate": "2027年2月2日（火）",
      "detailsStatus": "school-details-pending",
      "detailsStatusLabel": "学校別詳細の発表待ち",
      "officialPublishedAt": "2026-05-28",
      "verifiedAt": "2026-08-02",
      "notes": [
        "東京都教育委員会から共通日程が発表されています。",
        "募集人員、検査内容、配点など日比谷高校固有の詳細は未発表です。",
        "令和9年度実施要綱・同細目は2026年9月に公表予定です。"
      ],
      "sources": [
        {
          "title": "令和9年度東京都立高等学校入学者選抜の日程について",
          "url": "https://www.kyoiku.metro.tokyo.lg.jp/admission/high_school/exam/nyuusenn_9_20260528",
          "publishedAt": "2026-05-28",
          "verifiedAt": "2026-08-02"
        },
        {
          "title": "日比谷高校 入試案内・転学・編入学等",
          "url": "https://www.metro.ed.jp/hibiya-h/guide/guidance.html",
          "verifiedAt": "2026-08-02"
        }
      ]
    },
    {
      "schoolId": "wk_d113299901022",
      "academicYear": 2027,
      "selection": "general-first",
      "selectionLabel": "学力検査に基づく選抜（第一次募集）",
      "status": "schedule-announced",
      "statusLabel": "共通日程発表済み",
      "applicationPeriod": "志願者情報入力：2026年12月18日〜2027年2月4日17:00／書類提出：2027年1月29日〜2月4日",
      "testDates": [
        "2027年2月21日（日）"
      ],
      "resultDate": "2027年3月1日（月）",
      "detailsStatus": "school-details-pending",
      "detailsStatusLabel": "学校別詳細の発表待ち",
      "officialPublishedAt": "2026-05-28",
      "verifiedAt": "2026-08-02",
      "notes": [
        "東京都教育委員会から共通日程が発表されています。",
        "募集人員、検査科目、配点など日比谷高校固有の詳細は未発表です。",
        "過年度は国語・数学・英語が日比谷高校の問題、理科・社会・英語リスニングが都立高校共通問題です。2027年度も同じとは限らないため、実施要綱公表後に更新します。"
      ],
      "sources": [
        {
          "title": "令和9年度東京都立高等学校入学者選抜の日程について",
          "url": "https://www.kyoiku.metro.tokyo.lg.jp/admission/high_school/exam/nyuusenn_9_20260528",
          "publishedAt": "2026-05-28",
          "verifiedAt": "2026-08-02"
        },
        {
          "title": "日比谷高校 学力検査問題等",
          "url": "https://www.metro.ed.jp/hibiya-h/guide/test.html",
          "verifiedAt": "2026-08-02"
        }
      ]
    },
    {
      "schoolId": "wk_d113311800018",
      "academicYear": 2027,
      "selection": "general",
      "selectionLabel": "高等学校入学試験",
      "status": "schedule-announced",
      "statusLabel": "日程発表済み",
      "applicationPeriod": "2026年12月20日〜2027年1月27日",
      "testDates": ["2027年2月10日"],
      "resultDate": "2027年2月12日",
      "detailsStatus": "school-details-pending",
      "detailsStatusLabel": "詳細要項の発表待ち",
      "verifiedAt": "2026-08-02",
      "notes": ["募集人員は男子100人、試験科目は国語・数学・英語・理科・社会です。", "詳細な募集要項は2026年10月ごろ公開予定です。"],
      "sources": [{"title": "開成高等学校 2027年度入試", "url": "https://kaiseigakuen.jp/admission/high-school/", "verifiedAt": "2026-08-02"}]
    },
    {
      "schoolId": "wk_d113310300024",
      "academicYear": 2027,
      "selection": "recommendation",
      "selectionLabel": "推薦入学試験",
      "status": "schedule-announced",
      "statusLabel": "日程発表済み",
      "applicationPeriod": "2027年1月15日",
      "testDates": ["2027年1月22日"],
      "resultDate": "2027年1月23日",
      "detailsStatus": "school-details-pending",
      "detailsStatusLabel": "詳細要項の発表待ち",
      "verifiedAt": "2026-08-02",
      "notes": ["募集人員は約30人です。", "詳細な募集要項は2026年9月公開予定です。"],
      "sources": [{"title": "慶應義塾女子高等学校 2027年度推薦入試概要", "url": "https://www.gshs.keio.ac.jp/common/pdf/suisen.pdf", "verifiedAt": "2026-08-02"}]
    },
    {
      "schoolId": "wk_d113310300024",
      "academicYear": 2027,
      "selection": "returnee",
      "selectionLabel": "帰国生入学試験",
      "status": "schedule-announced",
      "statusLabel": "日程発表済み",
      "applicationPeriod": "2026年12月1日〜2027年1月11日",
      "testDates": ["2027年2月10日"],
      "resultDate": "2027年2月12日",
      "detailsStatus": "school-details-pending",
      "detailsStatusLabel": "詳細要項の発表待ち",
      "verifiedAt": "2026-08-02",
      "notes": ["募集人員は若干名です。", "詳細な募集要項は2026年9月公開予定です。"],
      "sources": [{"title": "慶應義塾女子高等学校 2027年度一般・帰国生入試概要", "url": "https://www.gshs.keio.ac.jp/common/pdf/ippan_kikoku.pdf", "verifiedAt": "2026-08-02"}]
    },
    {
      "schoolId": "wk_d113310300024",
      "academicYear": 2027,
      "selection": "general",
      "selectionLabel": "一般入学試験",
      "status": "schedule-announced",
      "statusLabel": "日程発表済み",
      "applicationPeriod": "2027年1月25日〜1月29日",
      "testDates": ["2027年2月10日"],
      "resultDate": "2027年2月12日",
      "detailsStatus": "school-details-pending",
      "detailsStatusLabel": "詳細要項の発表待ち",
      "verifiedAt": "2026-08-02",
      "notes": ["募集人員は約70人です。", "詳細な募集要項は2026年9月公開予定です。"],
      "sources": [{"title": "慶應義塾女子高等学校 2027年度一般・帰国生入試概要", "url": "https://www.gshs.keio.ac.jp/common/pdf/ippan_kikoku.pdf", "verifiedAt": "2026-08-02"}]
    },
    {
      "schoolId": "wk_d113311500084",
      "academicYear": 2027,
      "selection": "recommendation",
      "selectionLabel": "推薦入学試験",
      "status": "schedule-announced",
      "statusLabel": "学校別詳細発表済み",
      "applicationPeriod": "2027年1月15日〜1月17日15:00",
      "testDates": ["2027年1月22日"],
      "resultDate": "2027年1月22日20:00",
      "detailsStatus": "details-announced",
      "detailsStatusLabel": "学校別詳細発表済み",
      "verifiedAt": "2026-08-02",
      "notes": ["募集人員は135人です。"],
      "sources": [{"title": "中央大学杉並高等学校 2027年度入試情報", "url": "https://chusugi.jp/exam/information/", "verifiedAt": "2026-08-02"}]
    },
    {
      "schoolId": "wk_d113311500084",
      "academicYear": 2027,
      "selection": "returnee",
      "selectionLabel": "帰国生入学試験",
      "status": "schedule-announced",
      "statusLabel": "学校別詳細発表済み",
      "applicationPeriod": "2026年12月1日〜2027年1月13日12:00",
      "testDates": ["2027年1月23日"],
      "resultDate": "2027年1月23日20:00",
      "detailsStatus": "details-announced",
      "detailsStatusLabel": "学校別詳細発表済み",
      "verifiedAt": "2026-08-02",
      "notes": ["募集人員は15人です。"],
      "sources": [{"title": "中央大学杉並高等学校 2027年度入試情報", "url": "https://chusugi.jp/exam/information/", "verifiedAt": "2026-08-02"}]
    },
    {
      "schoolId": "wk_d113311500084",
      "academicYear": 2027,
      "selection": "general",
      "selectionLabel": "一般入学試験",
      "status": "schedule-announced",
      "statusLabel": "学校別詳細発表済み",
      "applicationPeriod": "2027年1月25日〜2月4日12:00",
      "testDates": ["2027年2月10日"],
      "resultDate": "2027年2月11日13:00",
      "detailsStatus": "details-announced",
      "detailsStatusLabel": "学校別詳細発表済み",
      "verifiedAt": "2026-08-02",
      "notes": ["募集人員は150人です。"],
      "sources": [{"title": "中央大学杉並高等学校 2027年度入試情報", "url": "https://chusugi.jp/exam/information/", "verifiedAt": "2026-08-02"}]
    },
    {
      "schoolId": "wk_d113311300013",
      "academicYear": 2027,
      "selection": "recommendation",
      "selectionLabel": "推薦入学試験",
      "status": "schedule-announced",
      "statusLabel": "学校別詳細発表済み",
      "applicationPeriod": "2026年12月20日〜2027年1月16日",
      "testDates": ["2027年1月30日"],
      "resultDate": "2027年1月31日19:00",
      "detailsStatus": "details-announced",
      "detailsStatusLabel": "学校別詳細発表済み",
      "verifiedAt": "2026-08-02",
      "notes": ["募集人員は65人です。"],
      "sources": [{"title": "青山学院高等部 2027年度入試日程", "url": "https://www.agh.aoyama.ed.jp/admission/schedule.html", "verifiedAt": "2026-08-02"}]
    },
    {
      "schoolId": "wk_d113311300013",
      "academicYear": 2027,
      "selection": "returnee",
      "selectionLabel": "帰国生入学試験",
      "status": "schedule-announced",
      "statusLabel": "学校別詳細発表済み",
      "applicationPeriod": "2026年12月1日〜2027年1月9日",
      "testDates": ["2027年1月30日"],
      "resultDate": "2027年1月31日19:00",
      "detailsStatus": "details-announced",
      "detailsStatusLabel": "学校別詳細発表済み",
      "verifiedAt": "2026-08-02",
      "notes": ["募集人員は25人です。"],
      "sources": [{"title": "青山学院高等部 2027年度入試日程", "url": "https://www.agh.aoyama.ed.jp/admission/schedule.html", "verifiedAt": "2026-08-02"}]
    },
    {
      "schoolId": "wk_d113311300013",
      "academicYear": 2027,
      "selection": "general",
      "selectionLabel": "一般入学試験",
      "status": "schedule-announced",
      "statusLabel": "学校別詳細発表済み",
      "applicationPeriod": "2026年12月20日〜2027年1月28日",
      "testDates": ["2027年2月12日"],
      "resultDate": "2027年2月13日18:00",
      "detailsStatus": "details-announced",
      "detailsStatusLabel": "学校別詳細発表済み",
      "verifiedAt": "2026-08-02",
      "notes": ["募集人員は70人です。"],
      "sources": [{"title": "青山学院高等部 2027年度入試日程", "url": "https://www.agh.aoyama.ed.jp/admission/schedule.html", "verifiedAt": "2026-08-02"}]
    },
    {
      "schoolId": "wk_d113110000067",
      "academicYear": 2027,
      "selection": "general",
      "selectionLabel": "一般入試",
      "status": "schedule-announced",
      "statusLabel": "概要発表済み",
      "applicationPeriod": "2026年10月公開予定の募集要項で発表",
      "testDates": ["2027年2月13日（土）"],
      "resultDate": "2027年2月15日（月）",
      "detailsStatus": "school-details-pending",
      "detailsStatusLabel": "募集要項の発表待ち",
      "officialPublishedAt": "2026-06-02",
      "verifiedAt": "2026-08-05",
      "notes": ["募集人員120人には附属中学校からの入学者（例年約60人）を含みます。", "検査は国語・社会・数学・理科・英語の5教科で、面接・実技はありません。", "推薦入試と帰国生特別枠は実施しません。"],
      "sources": [{ "title": "お茶の水女子大学附属高校 2027年度一般入試概要", "url": "https://www.fz.ocha.ac.jp/fk/menu/guidance/d015324.html", "publishedAt": "2026-06-02", "verifiedAt": "2026-08-05" }]
    },
    {
      "schoolId": "wk_d113110000012",
      "academicYear": 2027,
      "selection": "general",
      "selectionLabel": "一般中学生入試",
      "status": "schedule-announced",
      "statusLabel": "募集要項発表済み",